{
  "$schema": "https://json-schema.org/draft/2020-12/schema",
  "$id": "https://example.invalid/schemas/evidence_bundle.schema.json",
  "title": "EvidenceBundle",
  "type": "object",
  "additionalProperties": false,
  "required": [
    "bundle_version",
    "created_utc",
    "inputs",
    "artifacts",
    "toolchain",
    "policy"
  ],
  "$defs": {
    "json_value": {
      "oneOf": [
        {
          "type": "null"
        },
        {
          "type": "boolean"
        },
        {
          "type": "number"
        },
        {
          "type": "string"
        },
        {
          "type": "array",
          "items": {
            "$ref": "#/$defs/json_value"
          }
        },
        {
          "type": "object",
          "additionalProperties": false,
          "patternProperties": {
            "^.*$": {
              "$ref": "#/$defs/json_value"
            }
          }
        }
      ]
    }
  },
  "properties": {
    "bundle_version": {
      "type": "string",
      "minLength": 1
    },
    "created_utc": {
      "type": "string",
      "pattern": "^\\d{4}-\\d{2}-\\d{2}T\\d{2}:\\d{2}:\\d{2}(?:\\.\\d+)?Z$"
    },
    "inputs": {
      "type": "object",
      "additionalProperties": false,
      "required": [
        "prompt",
        "params"
      ],
      "properties": {
        "prompt": {
          "type": "string"
        },
        "params": {
          "type": "object",
          "additionalProperties": false,
          "patternProperties": {
            "^.*$": {
              "$ref": "#/$defs/json_value"
            }
          }
        }
      }
    },
    "artifacts": {
      "type": "array",
      "items": {
        "type": "object",
        "additionalProperties": false,
        "required": [
          "source_id",
          "chunk_id",
          "offset_start",
          "offset_end",
          "text",
          "text_sha256"
        ],
        "properties": {
          "source_id": {
            "type": "string",
            "minLength": 1
          },
          "chunk_id": {
            "type": "string",
            "minLength": 1
          },
          "offset_start": {
            "type": "integer",
            "minimum": 0
          },
          "offset_end": {
            "type": "integer",
            "minimum": 0
          },
          "text": {
            "type": "string"
          },
          "text_sha256": {
            "type": "string",
            "pattern": "^[0-9a-f]{64}$"
          },
          "heading_path": {
            "type": "array",
            "items": {
              "type": "string"
            }
          },
          "title": {
            "type": "string"
          },
          "categories": {
            "type": "array",
            "items": {
              "type": "string"
            }
          },
          "relative_path": {
            "type": "string"
          }
        }
      }
    },
    "toolchain": {
      "type": "object",
      "additionalProperties": false,
      "required": [
        "core_version",
        "parser_versions",
        "schema_versions"
      ],
      "properties": {
        "core_version": {
          "type": "string",
          "minLength": 1
        },
        "parser_versions": {
          "type": "object",
          "additionalProperties": false,
          "patternProperties": {
            "^.*$": {
              "type": "string"
            }
          }
        },
        "schema_versions": {
          "type": "object",
          "additionalProperties": false,
          "patternProperties": {
            "^.*$": {
              "type": "string"
            }
          }
        }
      }
    },
    "policy": {
      "type": "object",
      "additionalProperties": false,
      "required": [
        "ruleset_id"
      ],
      "properties": {
        "ruleset_id": {
          "type": "string",
          "minLength": 1
        }
      }
    }
  }
}
