{"artifacts":[{"chunk_id":"clean_pack","offset_end":7600,"offset_start":0,"source_id":"cuc:CUCV4-GROUNDING-06-CONFLICT-RECONCILIATION-PROCUREMENT-REVIEW","text":"{\"notes\":\"Draft v4 candidate case for CUCV4-GROUNDING-06-CONFLICT-RECONCILIATION-PROCUREMENT-REVIEW. Add a procurement reconciliation case with third-hop propagation so the pack stresses provenance and downstream dependency together.\",\"pack_role\":\"clean\",\"render_profile\":\"procurement_memo_v1\",\"schema_version\":\"1.0.0\",\"sections\":{\"causal_edges\":[{\"edge_id\":\"edge:primary_support\",\"evidence_ids\":[\"evidence:primary\"],\"from_id\":\"evidence:primary\",\"relation\":\"supports\",\"strength\":\"weak\",\"to_id\":\"state:primary\"},{\"edge_id\":\"edge:secondary_support\",\"evidence_ids\":[\"evidence:secondary\"],\"from_id\":\"evidence:secondary\",\"relation\":\"supports\",\"strength\":\"strong\",\"to_id\":\"state:secondary\"},{\"edge_id\":\"edge:bg_1\",\"evidence_ids\":[\"evidence:bg_1\"],\"from_id\":\"evidence:bg_1\",\"relation\":\"supports_background_context\",\"strength\":\"strong\",\"to_id\":\"state:bg_1\"},{\"edge_id\":\"edge:bg_2\",\"evidence_ids\":[\"evidence:bg_2\"],\"from_id\":\"evidence:bg_2\",\"relation\":\"supports_background_context\",\"strength\":\"medium\",\"to_id\":\"state:bg_2\"}],\"entities\":[{\"attributes\":{},\"entity_id\":\"entity:org\",\"label\":\"Harbor Transit\",\"type\":\"organization\"},{\"attributes\":{},\"entity_id\":\"entity:asset\",\"label\":\"single-source award\",\"type\":\"asset\"},{\"attributes\":{},\"entity_id\":\"entity:reviewer\",\"label\":\"oversight unit\",\"type\":\"role\"},{\"attributes\":{},\"entity_id\":\"entity:bg_1\",\"label\":\"vendor diligence packet a-1\",\"type\":\"background_context\"},{\"attributes\":{},\"entity_id\":\"entity:bg_2\",\"label\":\"renewal routing desk a-2\",\"type\":\"background_context\"}],\"events\":[{\"action\":\"checkpoint evaluation recorded\",\"actor_ids\":[\"entity:org\"],\"attributes\":{},\"event_id\":\"event:primary\",\"evidence_ids\":[\"evidence:primary\"],\"object_ids\":[\"entity:asset\"],\"time\":{\"kind\":\"exact\",\"value\":\"2026-04-01T14:00:00Z\"},\"type\":\"checkpoint_event\"},{\"action\":\"routine review completed\",\"actor_ids\":[\"entity:reviewer\"],\"attributes\":{},\"event_id\":\"event:secondary\",\"evidence_ids\":[\"evidence:secondary\"],\"object_ids\":[\"entity:org\"],\"time\":{\"kind\":\"exact\",\"value\":\"2026-04-01T08:00:00Z\"},\"type\":\"review_event\"},{\"action\":\"background procurement review checkpoint logged #1\",\"actor_ids\":[\"entity:bg_1\"],\"attributes\":{},\"event_id\":\"event:bg_1\",\"evidence_ids\":[\"evidence:bg_1\"],\"object_ids\":[\"entity:asset\"],\"time\":{\"kind\":\"exact\",\"value\":\"2026-04-01T14:00:00Z\"},\"type\":\"procurement_admin_event\"},{\"action\":\"background procurement review checkpoint logged #2\",\"actor_ids\":[\"entity:bg_2\"],\"attributes\":{},\"event_id\":\"event:bg_2\",\"evidence_ids\":[\"evidence:bg_2\"],\"object_ids\":[\"entity:asset\"],\"time\":{\"kind\":\"exact\",\"value\":\"2026-04-01T14:00:00Z\"},\"type\":\"procurement_admin_event\"}],\"evidence\":[{\"attributes\":{},\"content\":\"Harbor Transit records suggest single-source award still satisfies the primary condition under conflict_reconciliation review.\",\"evidence_id\":\"evidence:primary\",\"reliability\":\"medium\",\"source_id\":\"src:primary\",\"source_type\":\"award_memo\",\"time\":{\"kind\":\"exact\",\"value\":\"2026-04-01T14:00:00Z\"}},{\"attributes\":{},\"content\":\"Independent review shows Harbor Transit completed the routine control step for single-source award.\",\"evidence_id\":\"evidence:secondary\",\"reliability\":\"high\",\"source_id\":\"src:secondary\",\"source_type\":\"committee_minutes\",\"time\":{\"kind\":\"exact\",\"value\":\"2026-04-01T08:00:00Z\"}},{\"attributes\":{},\"content\":\"Supplementary procurement administration record preserved outside the core sourcing dispute. Case=CUCV4-GROUNDING-06-CONFLICT-RECONCILIATION-PROCUREMENT-REVIEW family=conflict reconciliation profile=procurement_memo_v1 context=1.\",\"evidence_id\":\"evidence:bg_1\",\"reliability\":\"high\",\"source_id\":\"src:bg_1\",\"source_type\":\"procurement_note\",\"time\":{\"kind\":\"exact\",\"value\":\"2026-04-01T14:00:00Z\"}},{\"attributes\":{},\"content\":\"Supplementary procurement administration record preserved outside the core sourcing dispute. Case=CUCV4-GROUNDING-06-CONFLICT-RECONCILIATION-PROCUREMENT-REVIEW family=conflict reconciliation profile=procurement_memo_v1 context=2.\",\"evidence_id\":\"evidence:bg_2\",\"reliability\":\"medium\",\"source_id\":\"src:bg_2\",\"source_type\":\"procurement_note\",\"time\":{\"kind\":\"exact\",\"value\":\"2026-04-01T14:00:00Z\"}}],\"metadata\":{\"authoring_status\":\"draft_surface_v1\",\"design_intent\":\"Add a procurement reconciliation case with third-hop propagation so the pack stresses provenance and downstream dependency together.\",\"named_evidence_artifact\":\"evidence:corroboration\",\"preserve_focus\":[\"state:secondary\"],\"revise_focus\":[\"state:primary\",\"state:hop3_dependency\"],\"sector_skin\":\"procurement_review\",\"surface_title\":\"PROCUREMENT REVIEW - CONFLICT RECONCILIATION REVIEW\"},\"scenarios\":[{\"basis_ids\":[\"state:primary\",\"edge:primary_support\"],\"label\":\"Primary theory remains most likely\",\"rank\":1,\"scenario_id\":\"scenario:primary\",\"status\":\"live\"},{\"basis_ids\":[\"state:secondary\",\"edge:secondary_support\"],\"label\":\"Alternate theory remains secondary\",\"rank\":2,\"scenario_id\":\"scenario:alternate\",\"status\":\"live\"},{\"basis_ids\":[\"state:bg_1\",\"edge:bg_1\"],\"label\":\"Administrative procurement context remains tertiary (dense_context)\",\"rank\":3,\"scenario_id\":\"scenario:bg_1\",\"status\":\"live\"}],\"states\":[{\"attributes\":{\"authoring_role\":\"revise_branch\"},\"confidence_band\":\"low\",\"evidence_ids\":[\"evidence:primary\"],\"object\":\"true\",\"predicate\":\"award_exception_justified\",\"state_id\":\"state:primary\",\"status\":\"contested\",\"subject_id\":\"entity:asset\",\"time\":{\"kind\":\"exact\",\"value\":\"2026-04-01T10:00:00Z\"}},{\"attributes\":{\"authoring_role\":\"preserve_branch\"},\"confidence_band\":\"high\",\"evidence_ids\":[\"evidence:secondary\"],\"object\":\"true\",\"predicate\":\"committee_review_recorded\",\"state_id\":\"state:secondary\",\"status\":\"supported\",\"subject_id\":\"entity:org\",\"time\":{\"kind\":\"exact\",\"value\":\"2026-04-01T09:00:00Z\"}},{\"attributes\":{\"authoring_role\":\"background_branch\"},\"confidence_band\":\"medium\",\"evidence_ids\":[\"evidence:bg_1\"],\"object\":\"true\",\"predicate\":\"procurement_context_stable_1\",\"state_id\":\"state:bg_1\",\"status\":\"supported\",\"subject_id\":\"entity:bg_1\",\"time\":{\"kind\":\"exact\",\"value\":\"2026-04-01T10:00:00Z\"}},{\"attributes\":{\"authoring_role\":\"background_branch\"},\"confidence_band\":\"medium\",\"evidence_ids\":[\"evidence:bg_2\"],\"object\":\"true\",\"predicate\":\"procurement_context_stable_2\",\"state_id\":\"state:bg_2\",\"status\":\"supported\",\"subject_id\":\"entity:bg_2\",\"time\":{\"kind\":\"exact\",\"value\":\"2026-04-01T10:00:00Z\"}}],\"unknowns\":[{\"category\":\"fact\",\"evidence_ids\":[\"evidence:primary\"],\"question\":\"Is the primary conclusion about single-source award still valid at the checkpoint?\",\"status\":\"open\",\"target_id\":\"state:primary\",\"unknown_id\":\"unknown:primary\"},{\"category\":\"other\",\"evidence_ids\":[\"evidence:secondary\"],\"question\":\"Does the preserved review evidence need any further follow-up?\",\"status\":\"open\",\"target_id\":\"event:secondary\",\"unknown_id\":\"unknown:secondary\"},{\"category\":\"other\",\"evidence_ids\":[\"evidence:bg_1\"],\"question\":\"Does the background procurement context require separate diligence for conflict reconciliation context 1 in conflict_reconciliation_procurement_review?\",\"status\":\"open\",\"target_id\":\"state:bg_1\",\"unknown_id\":\"unknown:bg_1\"},{\"category\":\"other\",\"evidence_ids\":[\"evidence:bg_2\"],\"question\":\"Does the background procurement context require separate diligence for conflict reconciliation context 2 in conflict_reconciliation_procurement_review?\",\"status\":\"open\",\"target_id\":\"state:bg_2\",\"unknown_id\":\"unknown:bg_2\"}]},\"seed\":40021,\"summary\":{\"edge_count\":4,\"entity_count\":5,\"event_count\":4,\"evidence_count\":4,\"scenario_count\":3,\"state_count\":4,\"unknown_count\":4},\"template_id\":\"tpl.v4.grounding.06.conflict.reconciliation.procurement.review\",\"world_id\":\"world:cucv4-grounding-06-conflict-reconciliation-procurement-review\"}","text_sha256":"27406af35fd7e788107ca9599e1b215ea2e5dd67aca1cd7bc147973310233fd1"},{"chunk_id":"perturbed_pack","offset_end":9775,"offset_start":0,"source_id":"cuc:CUCV4-GROUNDING-06-CONFLICT-RECONCILIATION-PROCUREMENT-REVIEW","text":"{\"notes\":\"Draft v4 candidate case for CUCV4-GROUNDING-06-CONFLICT-RECONCILIATION-PROCUREMENT-REVIEW. Add a procurement reconciliation case with third-hop propagation so the pack stresses provenance and downstream dependency together.\",\"pack_role\":\"perturbed\",\"render_profile\":\"procurement_memo_v1\",\"schema_version\":\"1.0.0\",\"sections\":{\"causal_edges\":[{\"edge_id\":\"edge:primary_support\",\"evidence_ids\":[\"evidence:primary\"],\"from_id\":\"evidence:primary\",\"relation\":\"supports\",\"strength\":\"strong\",\"to_id\":\"state:primary\"},{\"edge_id\":\"edge:secondary_support\",\"evidence_ids\":[\"evidence:secondary\"],\"from_id\":\"evidence:secondary\",\"relation\":\"supports\",\"strength\":\"strong\",\"to_id\":\"state:secondary\"},{\"edge_id\":\"edge:corroboration_support\",\"evidence_ids\":[\"evidence:corroboration\"],\"from_id\":\"evidence:corroboration\",\"relation\":\"corroborates\",\"strength\":\"strong\",\"to_id\":\"state:primary\"},{\"edge_id\":\"edge:bg_1\",\"evidence_ids\":[\"evidence:bg_1\"],\"from_id\":\"evidence:bg_1\",\"relation\":\"supports_background_context\",\"strength\":\"strong\",\"to_id\